{
  "$schema": "../schemas/tokens.schema.json",
  "name": "not-optional screen tokens",
  "version": "1.0.0",
  "note": "Example hexes. Swap any values that still meet principles/color-tokens.md and principles/contrast.md.",
  "tokens": {
    "color": {
      "canvas": {
        "value": "#F7F3EE"
      },
      "surface": {
        "value": "#E8D9C8"
      },
      "accent": {
        "value": "#7A8F7A"
      },
      "emphasis": {
        "value": "#4A5D4E"
      },
      "divider": {
        "value": "#DFCDBA"
      },
      "text": {
        "value": "#2C2A28"
      }
    },
    "focus": {
      "width": {
        "value": "3px"
      },
      "style": {
        "value": "solid"
      },
      "color": {
        "value": "#4A5D4E"
      },
      "offset": {
        "value": "2px"
      }
    }
  }
}
